{
  "spec_id": "unit_behavior_v1",
  "version": "1.3",
  "schema_version": "1.0.0",
  "goal_definitions": {
    "DEFEND": { "priority": 1, "utility_curve": "defense_curve", "target_effect": "enemy_health_reduced" },
    "SURVIVE": { "priority": 2, "utility_curve": "danger_curve", "target_effect": "safety_increased" },
    "RECOVER": { "priority": 3, "utility_curve": "health_curve", "target_effect": "health_increased" },
    "SETTLE": { "priority": 3, "utility_curve": "settle_curve", "target_effect": "city_founded" },
    "NUTRITION": { "priority": 4, "utility_curve": "hunger_curve", "target_effect": "inventory_food_increased" },
    "ATTACK_ORDER": { "priority": 4, "utility_curve": "aggression_curve", "target_effect": "enemy_health_reduced" },
    "STORE_RESOURCES": { "priority": 5, "utility_curve": "storage_curve", "target_effect": "resources_stored" },
    "GATHERING": { "priority": 5, "utility_curve": "wood_curve", "target_effect": "inventory_wood_increased" },
    "EXPANSION": { "priority": 6, "utility_curve": "expansion_curve", "target_effect": "house_created" },
    "EXPLORATION": { "priority": 7, "utility_curve": "exploration_curve", "target_effect": "explored_area" }
  },
  "actions": {
    "WANDER": { "id": 0, "cost": 1, "progress_step": 100, "pre": [], "eff": ["explored_area"] },
    "CHOP_WOOD": { "id": 1, "cost": 5, "progress_step": 20, "pre": ["forest_known"], "eff": ["inventory_wood_increased"] },
    "GATHER_FOOD": { "id": 2, "cost": 3, "progress_step": 34, "pre": ["food_known"], "eff": ["inventory_food_increased"] },
    "BUILD_HOUSE": { "id": 3, "cost": 20, "progress_step": 10, "pre": ["has_wood_3"], "eff": ["house_created"] },
    "ATTACK": { "id": 4, "cost": 10, "progress_step": 100, "pre": ["enemy_known"], "eff": ["enemy_health_reduced", "safety_increased"] },
    "FLEE": { "id": 5, "cost": 2, "progress_step": 100, "pre": ["enemy_nearby"], "eff": ["safety_increased"] },
    "HEAL": { "id": 6, "cost": 5, "progress_step": 20, "pre": ["is_at_home"], "eff": ["health_increased"] },
    "DELIVER": { "id": 7, "cost": 2, "progress_step": 50, "pre": ["has_wood_to_store"], "eff": ["resources_stored"] },
    "FOUND_CITY": { "id": 10, "cost": 50, "progress_step": 20, "pre": ["is_on_valid_land"], "eff": ["city_founded"] }
  },
  "utility_formulas": {
    "danger_curve": "enemy_nearby ? 100 : 0",
    "health_curve": "(100 - health)^2 / 100",
    "settle_curve": "(city_count < 1 && wood >= 3) ? 75 : 0",
    "hunger_curve": "hunger > 50 ? (hunger^2 / 100) : 0",
    "wood_curve": "wood < 3 ? 60 : 0",
    "expansion_curve": "wood >= 3 ? 80 : 0",
    "exploration_curve": "100 / (tiles_explored + 1)",
    "defense_curve": "enemy_near_home ? 100 : 0",
    "aggression_curve": "(enemy_known && military_strength_ratio > 1.5) ? 70 : 0",
    "storage_curve": "wood >= 3 ? 65 : 0"
  }
}
